{"$schema":"https://json-schema.org/draft/2020-12/schema","$id":"https://contracts.pulse-ivonix.site/event-bus/envelope/v1","title":"PULSE Event Envelope v1","type":"object","additionalProperties":false,"required":["event_id","event_type","event_version","envelope_version","occurred_at","producer","aggregate_type","aggregate_id","org_id","correlation_id","causation_id","payload","signature"],"properties":{"event_id":{"type":"string","pattern":"^[0-9A-HJKMNP-TV-Z]{26}$"},"event_type":{"type":"string","pattern":"^[a-z][a-z0-9]*(\\.[a-z0-9_]+)+$"},"event_version":{"type":"integer","minimum":1},"envelope_version":{"const":1},"occurred_at":{"type":"string","pattern":"^\\d{4}-\\d{2}-\\d{2}T\\d{2}:\\d{2}:\\d{2}\\.\\d{3}Z$"},"producer":{"type":"string","minLength":1,"maxLength":128},"aggregate_type":{"type":"string","minLength":1,"maxLength":128},"aggregate_id":{"type":"string","minLength":1,"maxLength":256},"org_id":{"anyOf":[{"type":"string","minLength":1},{"type":"null"}]},"correlation_id":{"type":"string","minLength":1},"causation_id":{"anyOf":[{"type":"string","minLength":1},{"type":"null"}]},"payload":{},"signature":{"type":"string","minLength":1,"contentEncoding":"base64"}}}